{
  "schema": "epg.run/0.1",
  "run_id": "REVIEWER-R1-2026-10-12",
  "protocol_id": "epg.publication.allturn",
  "protocol_version": "0.1.0-PROPOSED",
  "status": "EVALUATED",
  "basis": {
    "git_sha": "1199b38c1fd174e997c92b22d18d8c20c952eb9e",
    "protocol_sha256": null,
    "requirement_epoch": "gym-decisions-1-4@2026-10-11",
    "fixture_sha256": "fe0c651e51936074346c7dcabfef52785783e5a3d87f110c8365952b40a386d5"
  },
  "claims": [
    {
      "statement": "The reviewer re-derived the arms' central claims with fresh code rather than trusting them: 6/6 executable predicates pass, stable over 5 consecutive runs.",
      "evidence_class": "MEASURED",
      "witness_provenance": "INDEPENDENTLY_REPRODUCED",
      "witness_refs": [
        "runs/REVIEWER-R1-2026-10-12/reviewer-witness.mjs",
        "runs/REVIEWER-R1-2026-10-12/reviewer-witness-output.json"
      ]
    },
    {
      "statement": "The reviewer's own checker discriminates: 3/3 inverting mutants flip their predicate.",
      "evidence_class": "MEASURED",
      "witness_provenance": "INDEPENDENTLY_REPRODUCED",
      "witness_refs": [
        "runs/REVIEWER-R1-2026-10-12/negative-control.mjs"
      ]
    },
    {
      "statement": "W7 VERIFIED with a working control: a body-only mutation leaves the emitted .d.ts byte-identical while a signature mutation changes it.",
      "evidence_class": "MEASURED",
      "witness_provenance": "INDEPENDENTLY_REPRODUCED",
      "witness_refs": [
        "runs/REVIEWER-R1-2026-10-12/dts-mutation-check.mjs"
      ]
    },
    {
      "statement": "Five findings confirmed across arms: repeat's precondition is unenforced AND silent; classify(NaN)==='positive'; MAX_RETRIES is rigidly typed and unreferenced; repeat is not atomic; body-only mutation is invisible to the type surface.",
      "evidence_class": "MEASURED",
      "witness_provenance": "INDEPENDENTLY_REPRODUCED",
      "witness_refs": [
        "runs/REVIEWER-R1-2026-10-12/ROUND1-REVIEWER-SYNTHESIS.md"
      ]
    },
    {
      "statement": "Round 0 is four honest qualitative probes, NOT a measurement: one toy file, one model family, no real repo source, cost telemetry unknown for three arms.",
      "evidence_class": "MEASURED",
      "witness_provenance": "SELF_WITNESSED",
      "witness_refs": [
        "runs/REVIEWER-R1-2026-10-12/ROUND1-REVIEWER-SYNTHESIS.md"
      ]
    },
    {
      "statement": "The reviewer's own first answer was wrong and was corrected in-document (a 4000 ms threshold produced a claim about the source that was about the machine; the reviewer's fix then reproduced the same error via a timing slope).",
      "evidence_class": "MEASURED",
      "witness_provenance": "SELF_WITNESSED",
      "witness_refs": [
        "runs/REVIEWER-R1-2026-10-12/ROUND1-REVIEWER-SYNTHESIS.md"
      ]
    },
    {
      "statement": "NOTHING here is canon. Twelve proposals were dispositioned; no arm result was promoted. Ratification routes to DECISION_PROCESS_TRACKER.md.",
      "evidence_class": "DESIGN"
    },
    {
      "statement": "Benchmark R1 (cross-file silent-divergence recall) is specified but was NOT run; it requires owner go-ahead and agent budget.",
      "evidence_class": "UNKNOWN",
      "witness_provenance": "NONE",
      "witness_refs": []
    }
  ],
  "events": [
    {
      "id": "r1-start",
      "kind": "review_start",
      "time": "2026-10-12T14:10:00",
      "time_source": "HOST",
      "actor": "reviewer-session"
    },
    {
      "id": "r1-referee",
      "kind": "independent_referee_pass",
      "time": "2026-10-12T14:20:00",
      "time_source": "HOST",
      "actor": "reviewer-session",
      "evidence_ref": "runs/REVIEWER-R1-2026-10-12/reviewer-witness.mjs"
    },
    {
      "id": "r1-synthesis",
      "kind": "synthesis_published",
      "time": "2026-10-12T14:38:30",
      "time_source": "HOST",
      "actor": "reviewer-session"
    },
    {
      "id": "r1-repro",
      "kind": "independent_reproduction",
      "time": "2026-10-12T15:05:00",
      "time_source": "HOST",
      "actor": "lab-ops",
      "evidence_ref": "runs/REVIEWER-R1-2026-10-12/reviewer-witness.mjs"
    }
  ],
  "artifacts": [
    {
      "uri": "runs/REVIEWER-R1-2026-10-12/ADDENDUM-1-BACKBONE-ROUNDTRIP-AUDIT.md",
      "sha256": "38d2f26ec88b5abadb6edd7093d52f4a65e90e72bae2e7c4ab839340cf9576e8",
      "bytes": 11919,
      "state": "RUN_OUTPUT"
    },
    {
      "uri": "runs/REVIEWER-R1-2026-10-12/backbone-roundtrip-audit.mjs",
      "sha256": "1bac24af6e5cfaa6e5a03694858e010611dc4d3e132c6fd07d09fe22612f3232",
      "bytes": 16992,
      "state": "RUN_OUTPUT"
    },
    {
      "uri": "runs/REVIEWER-R1-2026-10-12/backbone-roundtrip-output.json",
      "sha256": "52e06320459cfcec216324cf4da44e77b2c70d27508cefcebda232fb9f5e19b6",
      "bytes": 5500,
      "state": "RUN_OUTPUT"
    },
    {
      "uri": "runs/REVIEWER-R1-2026-10-12/backbone-roundtrip-stderr.txt",
      "sha256": "e3b0c44298fc1c149afbf4c8996fb92427ae41e4649b934ca495991b7852b855",
      "bytes": 0,
      "state": "RUN_OUTPUT"
    },
    {
      "uri": "runs/REVIEWER-R1-2026-10-12/dts-mutation-check.mjs",
      "sha256": "e153a1c2607e069a2f7f2262073cb9b3a7f06ba65bbb8d048c1eaba683cd485e",
      "bytes": 4249,
      "state": "RUN_OUTPUT"
    },
    {
      "uri": "runs/REVIEWER-R1-2026-10-12/negative-control.mjs",
      "sha256": "42eaf53194af878f64010eb294a7ce13e64daf4e48414afcec3408af5cc13d5c",
      "bytes": 7749,
      "state": "RUN_OUTPUT"
    },
    {
      "uri": "runs/REVIEWER-R1-2026-10-12/reviewer-witness-output.json",
      "sha256": "c2f818afb9126765bbc2a481404727faa7659a38f1408009b4b640a17cbddc64",
      "bytes": 3015,
      "state": "RUN_OUTPUT"
    },
    {
      "uri": "runs/REVIEWER-R1-2026-10-12/reviewer-witness.mjs",
      "sha256": "b50386eaf4d4e580fbf0e9e0cba98ad2e8caec2a7531943234cd67dfa3794c63",
      "bytes": 9873,
      "state": "RUN_OUTPUT"
    },
    {
      "uri": "runs/REVIEWER-R1-2026-10-12/ROUND1-REVIEWER-SYNTHESIS.md",
      "sha256": "105103bbfaac82e662fb48bb13f2d3ef1d1e0a56f1ee8ffa416d53fbffde6af3",
      "bytes": 29028,
      "state": "RUN_OUTPUT"
    }
  ],
  "metrics": {
    "witness_predicates_passed": {
      "value": 6,
      "status": "MEASURED",
      "unit": "of 6"
    },
    "mutants_flipping": {
      "value": 3,
      "status": "MEASURED",
      "unit": "of 3"
    },
    "proposals_dispositioned": {
      "value": 12,
      "status": "MEASURED",
      "unit": "count"
    },
    "arms_adjudicated": {
      "value": 4,
      "status": "MEASURED",
      "unit": "count"
    },
    "results_promoted_to_canon": {
      "value": 0,
      "status": "MEASURED",
      "unit": "count"
    }
  },
  "publication": {
    "status": "PUBLISHED",
    "all_maturity_pack_index": "runs/REVIEWER-R1-2026-10-12/ROUND1-REVIEWER-SYNTHESIS.md",
    "reason": "Full synthesis with proposal register, custody section and reproduction commands."
  },
  "extensions": {
    "role": "reviewer — compares notes, does not re-run an arm",
    "known_correction": "This synthesis recorded REAL_SOURCE_UNAVAILABLE and routed Benchmark R1 as blocked. A later master-exec pass proved that conclusion WRONG: the R1 cohort is in-repo and pinned. The correction is recorded in the master-exec receipt rather than by editing this run's note, preserving its original state.",
    "next_seed_four_items": [
      "silent-instrument rule",
      "witness provenance vocabulary",
      "bound-before-reporting discipline",
      "re-declare REAL_SOURCE_UNAVAILABLE rather than inherit it"
    ]
  }
}
